{
  "week_label": "Week 2",
  "week_start": "2026-07-06",
  "week_end": "2026-07-12",
  "running_target_km": 21,
  "strength_target": 2,
  "long_run_target": 1,
  "days": [
    {
      "date": "2026-07-06",
      "day": "Mon",
      "status": "planned",
      "type": "Upper Body + Core",
      "content": "45–60min",
      "duration_min": 60,
      "completed": false
    },
    {
      "date": "2026-07-07",
      "day": "Tue",
      "status": "planned",
      "type": "Zone2",
      "content": "5km",
      "distance_km": 5,
      "completed": false
    },
    {
      "date": "2026-07-08",
      "day": "Wed",
      "status": "planned",
      "type": "Strength",
      "content": "Lower Body",
      "duration_min": 60,
      "completed": false,
      "focus": [
        "臀中肌",
        "腘绳肌",
        "单腿稳定"
      ]
    },
    {
      "date": "2026-07-09",
      "day": "Thu",
      "status": "planned",
      "type": "Recovery",
      "content": "30–40min",
      "duration_min": 40,
      "completed": false,
      "options": [
        "坡度走",
        "快走"
      ]
    },
    {
      "date": "2026-07-10",
      "day": "Fri",
      "status": "planned",
      "type": "Zone2",
      "content": "6km + 4×30s",
      "distance_km": 6,
      "completed": false
    },
    {
      "date": "2026-07-11",
      "day": "Sat",
      "status": "empty",
      "type": "Rest",
      "content": "Rest",
      "completed": false
    },
    {
      "date": "2026-07-12",
      "day": "Sun",
      "status": "planned",
      "type": "Long Run",
      "content": "9km Zone2",
      "distance_km": 9,
      "completed": false
    }
  ]
}
